{
  "schema_version": 2,
  "catalog_version": "2026.07.13.2",
  "published_at": "2026-07-13T17:02:02.678278Z",
  "servers": [
    {
      "id": "dcf9d503-34c5-52e3-a90b-87ddf2e6e673",
      "name": "Library of Congress (LC Catalog)",
      "host": "lx2.loc.gov",
      "port": 210,
      "database": "lcdb",
      "country_code": "US",
      "location_group": "USA",
      "record_syntax": "USMARC",
      "query_charset": "utf-8",
      "marc_charset": "auto",
      "priority": 0,
      "status": "active",
      "last_verified_at": "2026-07-13T17:02:02.678278Z"
    },
    {
      "id": "29ec67f9-2cd9-5d0c-af9d-b66a81b4b342",
      "name": "Library of Congress — National Library Service for the Blind and Print Disabled",
      "host": "lx2.loc.gov",
      "port": 210,
      "database": "nlsbph",
      "country_code": "US",
      "location_group": "USA",
      "record_syntax": "USMARC",
      "query_charset": "utf-8",
      "marc_charset": "auto",
      "priority": 10,
      "status": "active",
      "last_verified_at": "2026-07-13T17:02:02.678278Z"
    },
    {
      "id": "78bf9134-71d9-554c-aa3b-bbef53c67a0e",
      "name": "AarhusKarlshamn Sweden AB",
      "host": "z3950.libris.kb.se",
      "port": 210,
      "database": "libr",
      "country_code": "ZZ",
      "location_group": "Worldwide",
      "record_syntax": "USMARC",
      "query_charset": "utf-8",
      "marc_charset": "auto",
      "priority": 500,
      "status": "active",
      "last_verified_at": "2026-07-13T17:02:02.678278Z"
    },
    {
      "id": "334327e2-91e7-58de-9b1b-aab420ba1899",
      "name": "ABES (Fr.)",
      "host": "carmin.sudoc.abes.fr",
      "port": 10646,
      "database": "abes-z39-public",
      "country_code": "ZZ",
      "location_group": "Worldwide",
      "record_syntax": "USMARC",
      "query_charset": "utf-8",
      "marc_charset": "auto",
      "priority": 500,
      "status": "active",
      "last_verified_at": "2026-07-13T17:02:02.678278Z"
    },
    {
      "id": "73a111db-418b-5452-ab4c-9e5a62272fe8",
      "name": "Abilene Christian University (Tex.)",
      "host": "vmvm.alc.org",
      "port": 2200,
      "database": "unicorn",
      "country_code": "US",
      "location_group": "USA",
      "record_syntax": "USMARC",
      "query_charset": "utf-8",
      "marc_charset": "auto",
      "priority": 500,
      "status": "active",
      "last_verified_at": "2026-07-13T17:02:02.678278Z"
    },
    {
      "id": "aeb1db3a-78c6-5d55-9fc2-4b65045e21a8",
      "name": "Abilene Library Consortium -- Texas (SirsiDynix)",
      "host": "vmvm.alc.org",
      "port": 2200,
      "database": "Default",
      "country_code": "US",
      "location_group": "USA",
      "record_syntax": "USMARC",
      "query_charset": "utf-8",
      "marc_charset": "auto",
      "priority": 500,
      "status": "active",
      "last_verified_at": "2026-07-13T17:02:02.678278Z"
    },
    {
      "id": "b80ad1a1-0039-5d46-9749-a52499e462cb",
      "name": "Academica Sinica -- Taiwan (INNOPAC)",
      "host": "las.sinica.edu.tw",
      "port": 210,
      "database": "INNOPAC",
      "country_code": "TW",
      "location_group": "Worldwide",
      "record_syntax": "USMARC",
      "query_charset": "utf-8",
      "marc_charset": "auto",
      "priority": 500,
      "status": "active",
      "last_verified_at": "2026-07-13T17:02:02.678278Z"
    },
    {
      "id": "42c0d5b2-e7be-517b-82b5-a4c82cff8d9a",
      "name": "Adams State College (Colo.)",
      "host": "192.245.61.175",
      "port": 210,
      "database": "innopac",
      "country_code": "US",
      "location_group": "USA",
      "record_syntax": "USMARC",
      "query_charset": "utf-8",
      "marc_charset": "auto",
      "priority": 500,
      "status": "active",
      "last_verified_at": "2026-07-13T17:02:02.678278Z"
    },
    {
      "id": "f1bf4198-772d-50a2-93c2-2266a1fa2d65",
      "name": "Agencia Espanola de Cooperacion Internacional",
      "host": "rebiun.crue.org",
      "port": 210,
      "database": "absysrebiun",
      "country_code": "US",
      "location_group": "USA",
      "record_syntax": "USMARC",
      "query_charset": "utf-8",
      "marc_charset": "auto",
      "priority": 500,
      "status": "active",
      "last_verified_at": "2026-07-13T17:02:02.678278Z"
    },
    {
      "id": "4fd8aa68-c5b3-58ba-ba6a-5e1604d2673a",
      "name": "Albion College (Mich.)",
      "host": "elibrary.mel.org",
      "port": 210,
      "database": "innopac",
      "country_code": "US",
      "location_group": "USA",
      "record_syntax": "USMARC",
      "query_charset": "utf-8",
      "marc_charset": "auto",
      "priority": 500,
      "status": "active",
      "last_verified_at": "2026-07-13T17:02:02.678278Z"
    },
    {
      "id": "5a5ccca5-9ba0-52fb-ac0f-be2893db6eec",
      "name": "Alliant International University (Calif.)",
      "host": "csul.iii.com",
      "port": 210,
      "database": "innopac",
      "country_code": "US",
      "location_group": "USA",
      "record_syntax": "USMARC",
      "query_charset": "utf-8",
      "marc_charset": "auto",
      "priority": 500,
      "status": "active",
      "last_verified_at": "2026-07-13T17:02:02.678278Z"
    },
    {
      "id": "8380bf45-f494-5a06-94e0-dacfc862af0d",
      "name": "American University (Alma)",
      "host": "na04.alma.exlibrisgroup.com",
      "port": 1921,
      "database": "01WRLC_AMU",
      "country_code": "US",
      "location_group": "USA",
      "record_syntax": "USMARC",
      "query_charset": "utf-8",
      "marc_charset": "auto",
      "priority": 500,
      "status": "active",
      "last_verified_at": "2026-07-13T17:02:02.678278Z"
    },
    {
      "id": "ff016ee4-b509-5587-9f8c-fa056bd6fa64",
      "name": "Angelo State University (Tex.)",
      "host": "phl.angelo.edu",
      "port": 7090,
      "database": "voyager",
      "country_code": "US",
      "location_group": "USA",
      "record_syntax": "USMARC",
      "query_charset": "utf-8",
      "marc_charset": "auto",
      "priority": 500,
      "status": "active",
      "last_verified_at": "2026-07-13T17:02:02.678278Z"
    },
    {
      "id": "2ef8b33b-0143-503e-b632-921b9298c614",
      "name": "Arkansas Studies Institute",
      "host": "vera.cals.lib.ar.us",
      "port": 210,
      "database": "innopac",
      "country_code": "US",
      "location_group": "USA",
      "record_syntax": "USMARC",
      "query_charset": "utf-8",
      "marc_charset": "auto",
      "priority": 500,
      "status": "active",
      "last_verified_at": "2026-07-13T17:02:02.678278Z"
    },
    {
      "id": "4a88e82c-978d-5a07-8195-a493cf04f38f",
      "name": "Arlington Heights Memorial Library",
      "host": "iii.ahml.info",
      "port": 210,
      "database": "INNOPAC",
      "country_code": "US",
      "location_group": "USA",
      "record_syntax": "USMARC",
      "query_charset": "utf-8",
      "marc_charset": "auto",
      "priority": 500,
      "status": "active",
      "last_verified_at": "2026-07-13T17:02:02.678278Z"
    },
    {
      "id": "09ed45f7-b503-5ecb-b21b-4a4037e7f3d7",
      "name": "Auburn University (Ala.)",
      "host": "pooh.lib.auburn.edu",
      "port": 7290,
      "database": "voyager",
      "country_code": "US",
      "location_group": "USA",
      "record_syntax": "USMARC",
      "query_charset": "utf-8",
      "marc_charset": "auto",
      "priority": 500,
      "status": "active",
      "last_verified_at": "2026-07-13T17:02:02.678278Z"
    },
    {
      "id": "7e65e0e4-c304-5d52-abe9-462bc3cf1548",
      "name": "Auburn University (Voyager)",
      "host": "pooh.lib.auburn.edu",
      "port": 7090,
      "database": "VOYAGER",
      "country_code": "US",
      "location_group": "USA",
      "record_syntax": "USMARC",
      "query_charset": "utf-8",
      "marc_charset": "auto",
      "priority": 500,
      "status": "active",
      "last_verified_at": "2026-07-13T17:02:02.678278Z"
    },
    {
      "id": "9a7131f5-10ac-5b72-b3e8-f58f6522d933",
      "name": "Austin College (Tex.)",
      "host": "galileo.sirsi.net",
      "port": 2200,
      "database": "auco",
      "country_code": "US",
      "location_group": "USA",
      "record_syntax": "USMARC",
      "query_charset": "utf-8",
      "marc_charset": "auto",
      "priority": 500,
      "status": "active",
      "last_verified_at": "2026-07-13T17:02:02.678278Z"
    },
    {
      "id": "4812580f-fdb4-59a9-8216-dea9b5786443",
      "name": "Bangor University -- North Wales (Alma)",
      "host": "eu.alma.exlibrisgroup.com",
      "port": 210,
      "database": "44WHELF_BANG",
      "country_code": "US",
      "location_group": "USA",
      "record_syntax": "USMARC",
      "query_charset": "utf-8",
      "marc_charset": "auto",
      "priority": 500,
      "status": "active",
      "last_verified_at": "2026-07-13T17:02:02.678278Z"
    },
    {
      "id": "0452de33-9dff-5c95-800f-770b7ced2168",
      "name": "Bashkir State University (Rus.)",
      "host": "62.76.8.149",
      "port": 210,
      "database": "books",
      "country_code": "ZZ",
      "location_group": "Worldwide",
      "record_syntax": "USMARC",
      "query_charset": "utf-8",
      "marc_charset": "auto",
      "priority": 500,
      "status": "active",
      "last_verified_at": "2026-07-13T17:02:02.678278Z"
    },
    {
      "id": "824e5130-1b3b-5d27-a36d-cdebdaa0c886",
      "name": "Baton Rouge Community College (SirsiDynix)",
      "host": "brcc.louislibraries.org",
      "port": 5805,
      "database": "UNICORN",
      "country_code": "US",
      "location_group": "USA",
      "record_syntax": "USMARC",
      "query_charset": "utf-8",
      "marc_charset": "auto",
      "priority": 500,
      "status": "active",
      "last_verified_at": "2026-07-13T17:02:02.678278Z"
    },
    {
      "id": "b18c98b7-ee11-550d-9b65-21ce30312955",
      "name": "Biblioteca Foral de Bizkaia",
      "host": "bibliotecaforal.bizkaia.net",
      "port": 210,
      "database": "INNOPAC",